<?xml version="1.0" encoding="UTF-8"?>
<!--Sample XML file generated by XMLSpy v2009 sp1 (http://www.altova.com)-->
<Document xsi:schemaLocation="urn:cnaps:std:saps:2010:tech:xsd:saps.732.001.01 saps.732.001.01.xsd" xmlns="urn:cnaps:std:saps:2010:tech:xsd:saps.732.001.01" xmlns:xsi="http://www.w3.org/2001/XMLSchema-instance">
	<ACSABSSttlmDtlRspn>
		<GrpHdr>
			<MsgId>2010090977623325</MsgId>
			<CreDtTm>2010-09-09T09:30:47</CreDtTm>
			<InstgPty>
				<InstgDrctPty>0000</InstgDrctPty>
				<InstgPty>0000</InstgPty>
			</InstgPty>
			<InstdPty>
				<InstdDrctPty>308581000106</InstdDrctPty>
				<InstdPty>308581000106</InstdPty>
			</InstdPty>
			<SysCd>SAPS</SysCd>
			<Rmk>a</Rmk>
		</GrpHdr>
		<Prttn>
			<TtlNb>1</TtlNb>
			<StartNb>1</StartNb>
			<EndNb>1</EndNb>
		</Prttn>
		<OrgnlGrpHdr>
			<OrgnlMsgId>2010090977627598</OrgnlMsgId>
			<OrgnlInstgPty>308581000106</OrgnlInstgPty>
			<OrgnlMT>saps.732.001.01</OrgnlMT>
		</OrgnlGrpHdr>
		<NPCPrcInf>
			<PrcSts>PR05</PrcSts>
			<PrcCd>CB1I0000</PrcCd>
		</NPCPrcInf>
		<ACSABSSttlmDtlRspnInf>
			<ChckngDt>2010-09-09</ChckngDt>
			<ChckngInf>
				<UnltrlList>
					<MsgId>2010090977623398</MsgId>
					<BookgId>907100011301</BookgId>
					<DbtCdtId>CRDT</DbtCdtId>
					<Amt Ccy="CNY">100.00</Amt>
					<CtgyPurpCd>04201</CtgyPurpCd>
					<RspnSts>PR04</RspnSts>
				</UnltrlList>
				<RvslList>
					<MsgId>2010090977623392</MsgId>
					<BookgId>a</BookgId>
					<ErrDt>2010-08-13</ErrDt>
					<DbtCdtId>CRDT</DbtCdtId>
					<Amt Ccy="CNY">100.00</Amt>
					<PlusMnsTp>PM00</PlusMnsTp>
					<CtgyPurpCd>04201</CtgyPurpCd>
					<RspnSts>PR04</RspnSts>
				</RvslList>
				<NetgList>
					<MsgId>2010090977623391</MsgId>
					<RspnSts>PR04</RspnSts>
					<CtgyPurpCd>04201</CtgyPurpCd>
					<NetgRnd>1</NetgRnd>
					<DbtrAmt>AAA+100.00</DbtrAmt>
					<CdtrAmt>AAA+100.00</CdtrAmt>
					<NbOfMmb>1</NbOfMmb>
					<BookgList>
						<BookgId>222222222222</BookgId>
						<DbtCdtId>CRDT</DbtCdtId>
						<Amt Ccy="AAA">100.00</Amt>
					</BookgList>
				</NetgList>	
			</ChckngInf>
		</ACSABSSttlmDtlRspnInf>
	</ACSABSSttlmDtlRspn>
</Document>
